{
  "$schema": "https://zardui.com/schema/registry.json",
  "schemaVersion": 1,
  "name": "@zard",
  "homepage": "https://zardui.com",
  "version": "1.0.2",
  "items": [
    {
      "name": "core",
      "type": "registry:component",
      "icons": {
        "family": "lucide",
        "symbols": [],
        "tokens": []
      },
      "files": [
        "directives/string-template-outlet.directive.ts",
        "directives/id.directive.ts",
        "overlay/overlay-ref.ts",
        "overlay/overlay-stack.ts",
        "provider/event-manager-plugins/zard-debounce-event-manager-plugin.ts",
        "provider/event-manager-plugins/zard-event-manager-plugin.ts",
        "provider/providezard.ts",
        "i18n/i18n.constants.ts",
        "i18n/i18n.provider.ts",
        "i18n/i18n.service.ts",
        "i18n/i18n.tokens.ts",
        "i18n/i18n.types.ts",
        "i18n/index.ts",
        "i18n/locales/de-de.ts",
        "i18n/locales/en-us.ts",
        "i18n/locales/es-es.ts",
        "i18n/locales/fr-fr.ts",
        "i18n/locales/it-it.ts",
        "i18n/locales/pt-br.ts",
        "i18n/locales/pt-pt.ts",
        "i18n/locales/registry.ts",
        "css/zard.css",
        "index.ts"
      ]
    },
    {
      "name": "typeset",
      "type": "registry:component",
      "basePath": "styles",
      "icons": {
        "family": "lucide",
        "symbols": [],
        "tokens": []
      },
      "files": [
        "typeset.css"
      ]
    },
    {
      "name": "utilities",
      "type": "registry:component",
      "basePath": "styles",
      "icons": {
        "family": "lucide",
        "symbols": [],
        "tokens": []
      },
      "files": [
        "utilities.css"
      ]
    },
    {
      "name": "dark-mode",
      "type": "registry:component",
      "basePath": "services",
      "icons": {
        "family": "lucide",
        "symbols": [],
        "tokens": []
      },
      "files": [
        "index.ts",
        "dark-mode.ts"
      ]
    },
    {
      "name": "utils",
      "type": "registry:component",
      "basePath": "utils",
      "dependencies": [
        "tailwind-merge",
        "clsx"
      ],
      "icons": {
        "family": "lucide",
        "symbols": [],
        "tokens": []
      },
      "files": [
        "index.ts",
        "merge-classes.ts",
        "noop.ts",
        "number.ts"
      ]
    },
    {
      "name": "sidebar",
      "type": "registry:component",
      "registryDependencies": [
        "button",
        "tooltip",
        "skeleton",
        "separator"
      ],
      "icons": {
        "family": "lucide",
        "symbols": [
          "lucidePanelLeft"
        ],
        "tokens": [
          "panel-left"
        ]
      },
      "files": [
        "sidebar.component.ts",
        "sidebar-primitives.component.ts",
        "sidebar-menu.component.ts",
        "sidebar.constants.ts",
        "sidebar.service.ts",
        "sidebar.variants.ts",
        "sidebar.imports.ts",
        "index.ts"
      ]
    },
    {
      "name": "button",
      "type": "registry:component",
      "icons": {
        "family": "lucide",
        "symbols": [
          "lucideLoaderCircle"
        ],
        "tokens": [
          "loader-circle"
        ]
      },
      "files": [
        "button.component.ts",
        "button.variants.ts",
        "index.ts"
      ]
    },
    {
      "name": "sheet",
      "type": "registry:component",
      "registryDependencies": [
        "button"
      ],
      "icons": {
        "family": "lucide",
        "symbols": [
          "lucideX"
        ],
        "tokens": [
          "x"
        ]
      },
      "files": [
        "sheet.component.ts",
        "sheet-panel.component.ts",
        "sheet-container.component.ts",
        "sheet-host.ts",
        "sheet.variants.ts",
        "sheet-ref.ts",
        "sheet.imports.ts",
        "sheet.service.ts",
        "index.ts"
      ]
    },
    {
      "name": "card",
      "type": "registry:component",
      "icons": {
        "family": "lucide",
        "symbols": [],
        "tokens": []
      },
      "files": [
        "card.component.ts",
        "card.imports.ts",
        "card.variants.ts",
        "index.ts"
      ]
    },
    {
      "name": "empty",
      "type": "registry:component",
      "icons": {
        "family": "lucide",
        "symbols": [],
        "tokens": []
      },
      "files": [
        "empty.component.ts",
        "empty.variants.ts",
        "index.ts"
      ]
    },
    {
      "name": "field",
      "type": "registry:component",
      "icons": {
        "family": "lucide",
        "symbols": [],
        "tokens": []
      },
      "files": [
        "field.component.ts",
        "field.variants.ts",
        "field.imports.ts",
        "index.ts"
      ]
    },
    {
      "name": "badge",
      "type": "registry:component",
      "icons": {
        "family": "lucide",
        "symbols": [],
        "tokens": []
      },
      "files": [
        "badge.component.ts",
        "badge.variants.ts",
        "index.ts"
      ]
    },
    {
      "name": "accordion",
      "type": "registry:component",
      "icons": {
        "family": "lucide",
        "symbols": [
          "lucideChevronDown"
        ],
        "tokens": [
          "chevron-down"
        ]
      },
      "files": [
        "accordion.component.ts",
        "accordion-item.component.ts",
        "accordion.variants.ts",
        "accordion.imports.ts",
        "index.ts"
      ]
    },
    {
      "name": "alert",
      "type": "registry:component",
      "icons": {
        "family": "lucide",
        "symbols": [
          "lucideCircleAlert"
        ],
        "tokens": [
          "circle-alert"
        ]
      },
      "files": [
        "alert.component.ts",
        "alert.variants.ts",
        "index.ts"
      ]
    },
    {
      "name": "alert-dialog",
      "type": "registry:component",
      "registryDependencies": [
        "button"
      ],
      "icons": {
        "family": "lucide",
        "symbols": [],
        "tokens": []
      },
      "files": [
        "alert-dialog.component.ts",
        "alert-dialog-panel.component.ts",
        "alert-dialog-container.component.ts",
        "alert-dialog-host.ts",
        "alert-dialog.imports.ts",
        "alert-dialog.service.ts",
        "alert-dialog-ref.ts",
        "alert-dialog.variants.ts",
        "index.ts"
      ]
    },
    {
      "name": "avatar",
      "type": "registry:component",
      "icons": {
        "family": "lucide",
        "symbols": [],
        "tokens": []
      },
      "files": [
        "avatar.imports.ts",
        "avatar.component.ts",
        "avatar-group.component.ts",
        "avatar-group-count.component.ts",
        "avatar.variants.ts",
        "index.ts"
      ]
    },
    {
      "name": "checkbox",
      "type": "registry:component",
      "icons": {
        "family": "lucide",
        "symbols": [
          "lucideCheck"
        ],
        "tokens": [
          "check"
        ]
      },
      "files": [
        "checkbox.component.ts",
        "checkbox.variants.ts",
        "index.ts"
      ]
    },
    {
      "name": "collapsible",
      "type": "registry:component",
      "icons": {
        "family": "lucide",
        "symbols": [],
        "tokens": []
      },
      "files": [
        "collapsible.component.ts",
        "collapsible.variants.ts",
        "collapsible.imports.ts",
        "index.ts"
      ]
    },
    {
      "name": "drawer",
      "type": "registry:component",
      "registryDependencies": [
        "button"
      ],
      "icons": {
        "family": "lucide",
        "symbols": [
          "lucideX"
        ],
        "tokens": [
          "x"
        ]
      },
      "files": [
        "drawer.component.ts",
        "drawer-panel.component.ts",
        "drawer-container.component.ts",
        "drawer-host.ts",
        "drawer-stack.ts",
        "drawer-ref.ts",
        "drawer.service.ts",
        "drawer.utils.ts",
        "drawer.variants.ts",
        "drawer.imports.ts",
        "index.ts"
      ]
    },
    {
      "name": "dialog",
      "type": "registry:component",
      "registryDependencies": [
        "button"
      ],
      "icons": {
        "family": "lucide",
        "symbols": [
          "lucideX"
        ],
        "tokens": [
          "x"
        ]
      },
      "files": [
        "dialog.component.ts",
        "dialog-panel.component.ts",
        "dialog-container.component.ts",
        "dialog-host.ts",
        "dialog.service.ts",
        "dialog-ref.ts",
        "dialog.variants.ts",
        "dialog.imports.ts",
        "index.ts"
      ]
    },
    {
      "name": "context-menu",
      "type": "registry:component",
      "registryDependencies": [
        "dropdown"
      ],
      "icons": {
        "family": "lucide",
        "symbols": [],
        "tokens": []
      },
      "files": [
        "context-menu.directive.ts",
        "context-menu.service.ts",
        "context-menu.imports.ts",
        "index.ts"
      ]
    },
    {
      "name": "dropdown",
      "type": "registry:component",
      "icons": {
        "family": "lucide",
        "symbols": [
          "lucideChevronRight"
        ],
        "tokens": [
          "chevron-right"
        ]
      },
      "files": [
        "dropdown.component.ts",
        "dropdown-submenu.component.ts",
        "menu-keyboard.ts",
        "dropdown-item.component.ts",
        "dropdown-menu-content.component.ts",
        "dropdown-positions.ts",
        "dropdown-primitives.component.ts",
        "dropdown-trigger.directive.ts",
        "dropdown.imports.ts",
        "dropdown.service.ts",
        "dropdown.variants.ts",
        "index.ts"
      ]
    },
    {
      "name": "input",
      "type": "registry:component",
      "registryDependencies": [
        "input-group"
      ],
      "icons": {
        "family": "lucide",
        "symbols": [],
        "tokens": []
      },
      "files": [